{
  "$schema": "https://json-schema.org/draft/2020-12/schema",
  "type": "object",
  "additionalProperties": false,
  "required": [
    "contractVersion",
    "kind",
    "id",
    "revision",
    "reviewedAt",
    "mediaContentId",
    "entries"
  ],
  "properties": {
    "contractVersion": {
      "const": "1"
    },
    "kind": {
      "const": "public-eligibility-snapshot"
    },
    "id": {
      "$ref": "publication/common.schema.json#/$defs/token"
    },
    "revision": {
      "$ref": "publication/common.schema.json#/$defs/token"
    },
    "reviewedAt": {
      "type": "string",
      "format": "date-time",
      "pattern": "Z$"
    },
    "mediaContentId": {
      "$ref": "publication/common.schema.json#/$defs/digest"
    },
    "entries": {
      "type": "array",
      "items": {
        "type": "object",
        "additionalProperties": false,
        "required": [
          "flavor",
          "projectionContentId",
          "canonicalArtwork",
          "artwork",
          "use",
          "validity"
        ],
        "properties": {
          "flavor": {
            "$ref": "publication/common.schema.json#/$defs/flavorRef"
          },
          "projectionContentId": {
            "$ref": "publication/common.schema.json#/$defs/digest"
          },
          "canonicalArtwork": {
            "$ref": "publication/common.schema.json#/$defs/assetRef"
          },
          "artwork": {
            "$ref": "publication/projection.schema.json#/properties/artwork"
          },
          "use": {
            "enum": [
              "web",
              "package"
            ]
          },
          "validity": {
            "enum": [
              "eligible-at-review",
              "ineligible",
              "stale",
              "revoked",
              "superseded",
              "rejected",
              "conflicted",
              "unverified"
            ]
          }
        }
      }
    }
  }
}
