{
  "contractVersion": "1",
  "kind": "public-eligibility-snapshot",
  "id": "grape-web-eligibility",
  "revision": "r1",
  "reviewedAt": "2026-10-12T05:26:37Z",
  "mediaContentId": "sha256:13dd9aa14d6d902909287c29c268fa92442894f16f68d179fabfd9b258067047",
  "entries": [
    {
      "flavor": {
        "id": "grape",
        "revision": "r2"
      },
      "projectionContentId": "sha256:e031aab601753eb4fa0d1060f68d586d362d0da59effc29184b3719355149620",
      "canonicalArtwork": {
        "assetId": "grape-package-artwork",
        "revision": "r1",
        "contentId": "sha256:6ac10d7bc79b331ee310e3c54c1f78688c884cc8fa1ef0b9be0e281e67e5a04b"
      },
      "artwork": {
        "assetId": "grape-web-artwork",
        "revision": "r1",
        "contentId": "sha256:66c5313e7bb9dd8bc733f51aa56b1c7d5679a463a67a1c11deffd9326aade839",
        "deliveryRef": "grape-web-r1",
        "recipe": "grape-full-frame-webp",
        "recipeVersion": "1",
        "parameters": {
          "resize": {
            "width": 1024,
            "fit": "inside",
            "withoutEnlargement": true,
            "kernel": "lanczos3",
            "fastShrinkOnLoad": false
          },
          "webp": {
            "lossless": true,
            "effort": 6
          }
        }
      },
      "use": "web",
      "validity": "eligible-at-review"
    }
  ]
}
